citationID,citationName,citedReferences
66a28c343220bb10563d865bc1a8ff05cb0c2723,Influence of porosity and cement grade on concrete mechanical properties,a347f937fcc096c7e6ee6a18c658911916359373$$@$$25639e4b9488e982914dd862f77a5a77e0021f09$$@$$01ea81abfc008069d0bda99a2558126badeb3a3c$$@$$13e3ffd0e97b8dd11564172c04355f578b6e8518$$@$$07c2763f31c28e49a0a7d22fad0548db27b3cb91$$@$$645b9d86189bfcdd9718759542ca49548cd79f44
0f91bd05d8e6df0d6aa25fa71c02a0f0315be379,Nonlocal dynamic modeling of mass sensors consisting of graphene sheets based on strain gradient theory,a347f937fcc096c7e6ee6a18c658911916359373$$@$$25639e4b9488e982914dd862f77a5a77e0021f09$$@$$01ea81abfc008069d0bda99a2558126badeb3a3c$$@$$13e3ffd0e97b8dd11564172c04355f578b6e8518$$@$$07c2763f31c28e49a0a7d22fad0548db27b3cb91$$@$$645b9d86189bfcdd9718759542ca49548cd79f44
5ea3a1b21a52b45154189ee56c0bc7ee85832fa3,Computational parameter identification of strongest influence on the shear resistance of reinforced concrete beams by fiber reinforcement polymer,645b9d86189bfcdd9718759542ca49548cd79f44$$@$$01ea81abfc008069d0bda99a2558126badeb3a3c$$@$$07c2763f31c28e49a0a7d22fad0548db27b3cb91$$@$$25639e4b9488e982914dd862f77a5a77e0021f09
28f206301696a9ff2bed9a043ad1a78813126413,Experimental study on shaped steel shear connectors used in large-scale composite structures,645b9d86189bfcdd9718759542ca49548cd79f44$$@$$01ea81abfc008069d0bda99a2558126badeb3a3c$$@$$25639e4b9488e982914dd862f77a5a77e0021f09
830ee8d8767d55403c5ce63ccc149302547db816,Application of extreme learning machine in behavior of beam to column connections,25639e4b9488e982914dd862f77a5a77e0021f09$$@$$01ea81abfc008069d0bda99a2558126badeb3a3c$$@$$645b9d86189bfcdd9718759542ca49548cd79f44$$@$$07c2763f31c28e49a0a7d22fad0548db27b3cb91$$@$$f2df0c1026ffa474f603a535e48e5c115d3d8629$$@$$cbdb093c51072f696503975c73880a9dd3a44bcf
f4f96885d5f027d8ece858a1ecfb7179f4dc8905,Performance assessment of buckling restrained brace with tubular profile,a347f937fcc096c7e6ee6a18c658911916359373$$@$$25639e4b9488e982914dd862f77a5a77e0021f09$$@$$01ea81abfc008069d0bda99a2558126badeb3a3c$$@$$07c2763f31c28e49a0a7d22fad0548db27b3cb91$$@$$645b9d86189bfcdd9718759542ca49548cd79f44
13173e1139950c24d0c56da5d5364e17d02bbb28,Elevated temperature resistance of concrete columns with axial loading,a347f937fcc096c7e6ee6a18c658911916359373$$@$$25639e4b9488e982914dd862f77a5a77e0021f09$$@$$01ea81abfc008069d0bda99a2558126badeb3a3c$$@$$07c2763f31c28e49a0a7d22fad0548db27b3cb91$$@$$645b9d86189bfcdd9718759542ca49548cd79f44
ae6689714864daeb16ad6ddf8213acf5fe3da227,A novel approach to predict shear strength of tilted angle connectors using artificial intelligence techniques,a347f937fcc096c7e6ee6a18c658911916359373$$@$$25639e4b9488e982914dd862f77a5a77e0021f09$$@$$01ea81abfc008069d0bda99a2558126badeb3a3c$$@$$645b9d86189bfcdd9718759542ca49548cd79f44$$@$$07c2763f31c28e49a0a7d22fad0548db27b3cb91$$@$$f2df0c1026ffa474f603a535e48e5c115d3d8629
2a4897b79752453112c67d53a5a3a58a0bf9efce,Experimental investigation on the effect of cementitious materials on fresh and mechanical properties of self-consolidating concrete,a347f937fcc096c7e6ee6a18c658911916359373$$@$$25639e4b9488e982914dd862f77a5a77e0021f09$$@$$01ea81abfc008069d0bda99a2558126badeb3a3c$$@$$13e3ffd0e97b8dd11564172c04355f578b6e8518$$@$$07c2763f31c28e49a0a7d22fad0548db27b3cb91$$@$$645b9d86189bfcdd9718759542ca49548cd79f44
d540027f75fb8d39fbf1418a632588213f7c86cb,Analysis of the Seismic Performance of a Two-Span Specially Shaped Column Frame,13e3ffd0e97b8dd11564172c04355f578b6e8518$$@$$a347f937fcc096c7e6ee6a18c658911916359373$$@$$07c2763f31c28e49a0a7d22fad0548db27b3cb91
822bc6f1b048fdb63c8958d8fc8eba718c9dfe9c,Computational optimized finite element modelling of mechanical interaction of concrete with fiber reinforced polymer,a347f937fcc096c7e6ee6a18c658911916359373$$@$$25639e4b9488e982914dd862f77a5a77e0021f09$$@$$01ea81abfc008069d0bda99a2558126badeb3a3c$$@$$13e3ffd0e97b8dd11564172c04355f578b6e8518$$@$$07c2763f31c28e49a0a7d22fad0548db27b3cb91$$@$$645b9d86189bfcdd9718759542ca49548cd79f44
8f72fcda5aecfd783bc9d104c9d440445908654c,Analysis of influential factors for predicting the shear strength of a V-shaped angle shear connector in composite beams using an adaptive neuro-fuzzy technique,da4d973c992dd93da8a81298c2335112aeae3800$$@$$eed5557d9c07a3f63099097b0b704acbb7a52db0
73029380b4e8b7a55e90b42cdb36d27d2f09bbb8,Retraction Note to: Potential of soft computing approach for evaluating the factors affecting the capacity of steel–concrete composite beam,ab9887cbfc4dcc19eb942ecad5255556b8ad8909$$@$$61f4267e175528bd9803a6b58651807786e3870c$$@$$2b9c0e4d1d473aadbe1c2a76f75bc02bfa6416b0$$@$$872b26ec2fef325923a4c7ecdcab08f5a899d5cf$$@$$07c2763f31c28e49a0a7d22fad0548db27b3cb91$$@$$645b9d86189bfcdd9718759542ca49548cd79f44$$@$$f6a24032e5a60e8406100087635f400bd0356998$$@$$25639e4b9488e982914dd862f77a5a77e0021f09$$@$$14febc27f9369febf9f9a48f2ccfb4f7ed176304$$@$$2b9ff15076ad9e4cd7f9df3fd108743adebbe631$$@$$da4d973c992dd93da8a81298c2335112aeae3800$$@$$eed5557d9c07a3f63099097b0b704acbb7a52db0$$@$$f2df0c1026ffa474f603a535e48e5c115d3d8629$$@$$2f7f0021709d49e07e5fbc0a2fd07e586bf92c67$$@$$cbdb093c51072f696503975c73880a9dd3a44bcf$$@$$a347f937fcc096c7e6ee6a18c658911916359373$$@$$5fd62292add2c0cd7dee0afc44c6a03f8e1864aa$$@$$01ea81abfc008069d0bda99a2558126badeb3a3c$$@$$1c00df1cb85fa7886b6666599eab59f2b301dd5d$$@$$0ed9a5233897b2f3c76b0a508ee44fda23c61f86$$@$$db5aa767a0e8ceb09e7202f708e15a37bbc7ca01$$@$$be2a79e86434a21790930df67f45bae72d1e3aa6$$@$$a87102a657db34d88cac80736742647fc0d1561d$$@$$00bfab2caba705be7d9bd29ef2128b0154ce6c20$$@$$13e3ffd0e97b8dd11564172c04355f578b6e8518$$@$$2903c87ed0d5a4d46c0777b3d823ea60c923a64e$$@$$5d11aad09f65431b5d3cb1d85328743c9e53ba96
da5dce855db0e7dc05fdb1dc85b076c78bb0e38f,Assessment of stiffened angle shear connector under monotonic and fully reversed cyclic loading,da4d973c992dd93da8a81298c2335112aeae3800$$@$$01ea81abfc008069d0bda99a2558126badeb3a3c$$@$$eed5557d9c07a3f63099097b0b704acbb7a52db0
c1e2d6062bdef115ecd57e939e19914537c628f5,RETRACTED ARTICLE: Analysis of influential factors for predicting the shear strength of a V-shaped angle shear connector in composite beams using an adaptive neuro-fuzzy technique,da4d973c992dd93da8a81298c2335112aeae3800$$@$$eed5557d9c07a3f63099097b0b704acbb7a52db0
8b536d2dc04db5e38f12ab31d175d4d1630b6d3e,Numerical analysis of tilted angle shear connectors in steel-concrete composite systems,da4d973c992dd93da8a81298c2335112aeae3800$$@$$01ea81abfc008069d0bda99a2558126badeb3a3c$$@$$25639e4b9488e982914dd862f77a5a77e0021f09$$@$$eed5557d9c07a3f63099097b0b704acbb7a52db0
