citationID,citationName,citedReferences
c9bba378e09e8575054293ba123c601f256959bc,Failure mode and effect analysis using VIKOR method based on interval-valued linguistic Z-numbers,74d5e9445c8154c8a77cc71487a4c5cfd9a9588c
295ca80bd9ec67526ff952d5e9c9f17ba4411644,An integrated method for complex heterogeneous multi-attribute group decision-making and application to photovoltaic power station site selection,74d5e9445c8154c8a77cc71487a4c5cfd9a9588c
cd6422607c85df41ac3103ddcb71af297b3347de,A group consensus model with prospect theory under probabilistic linguistic term sets,20a579236b1c00a47ad70ba415a2eb95759ac1a0$$@$$74d5e9445c8154c8a77cc71487a4c5cfd9a9588c
e8f1c10af989b82a2f02215087998d2231e23f90,A general model of ambiguous sets to a single-valued ambiguous numbers with aggregation operators,26f15d696dc84cb3377568aaf4423c1c1928dfc5$$@$$72e3c051f4159a82dfb66c56338a1790afdf49f8$$@$$ce583eca7b4ec66a141d9573046da224ca33a7f3$$@$$e0f0471bcab5f05948c6f53fbe3770b311fd97f5$$@$$20a579236b1c00a47ad70ba415a2eb95759ac1a0$$@$$f56e8ad503cc122a91b84b7e9f4b05507a5fdf80$$@$$118d636731bc100eeeb7f81dca59919895cd01aa$$@$$6398f2a25cb985ee48e985314510b9f16b708397
9b21acc978c654d593d8c143e7ea4ada19d7731e,A generalized linguistic gained and lost dominance score method for landslide hazard treatment,58a1de70b53147a977e0745840efe12c87938a40$$@$$20a579236b1c00a47ad70ba415a2eb95759ac1a0$$@$$ce538378a9f9fb1b8ded834b4745c7f15c19cd40$$@$$74d5e9445c8154c8a77cc71487a4c5cfd9a9588c
69a9fdc62dea85e1c2260e7cf0dd6ee482c5f37a,A MAGDM model based on 2-tuple linguistic variables and power Hamacher aggregation operators for optimal selection of digital marketing strategies,20a579236b1c00a47ad70ba415a2eb95759ac1a0$$@$$74d5e9445c8154c8a77cc71487a4c5cfd9a9588c
7de0fb342139c716b818a74810269b3339a61bb4,Group decision-making method based on expert credibility with multi-granularity probabilistic linguistic Z-number preference relation,74d5e9445c8154c8a77cc71487a4c5cfd9a9588c
27b2bf267d77808faf5d75a90e11da0200bbb546,A fuzzy parametric model for decision making involving F-OWA operator with unknown weights environment,6398f2a25cb985ee48e985314510b9f16b708397
495130ca339d97841d4947e1dc833257bf5f7e35,A Linguistic Cloud-Based Consensus Framework with Three Behavior Classifications Under Trust-Interest Relations,4145e178692a5d690d43ad0fcf0fb3cae2ddd207
ad856dcf94fe9191cbcf3df4de5f113e56489053,Group decision making approach based on linguistic q-rung orthopair fuzzy generalized shapley bi-direction Choquet-copula operators,4145e178692a5d690d43ad0fcf0fb3cae2ddd207$$@$$74d5e9445c8154c8a77cc71487a4c5cfd9a9588c
c7ec3f67a4f9981d3f872607015e92e9e8db61e2,A hybrid multi-criteria decision-making framework of EWM-BWM-TODIM based on Linguistic Pythagorean fuzzy environment,74d5e9445c8154c8a77cc71487a4c5cfd9a9588c
4253ead0a0c1a09ca22b9dbf34d32b13d49c6fbe,A new extension of fuzzy set and their applications to multi-attribute group decision making,20a579236b1c00a47ad70ba415a2eb95759ac1a0$$@$$74d5e9445c8154c8a77cc71487a4c5cfd9a9588c
0e06c311ec0b6dfbd19253e4a9e16c17c5256df0,Two improved N-two-stage K-means clustering aggregation algorithmic paradigms for HFLTS possibility distributions,f300a4b674ca36708c91d7927cd8eb97d7bffb5c$$@$$20a579236b1c00a47ad70ba415a2eb95759ac1a0$$@$$74d5e9445c8154c8a77cc71487a4c5cfd9a9588c
101a9d607063f604f90231bb65e158e51b69a398,A new three way decision making technique for supplier selection in logistics service value Cocreation under intuitionistic double hierarchy linguistic term set,20a579236b1c00a47ad70ba415a2eb95759ac1a0
df341e4d479fa20f1a810f0c0f972ffc078cb96b,An investigation of ambiguous sets and their application to decision-making from partial order to lattice ambiguous sets,26f15d696dc84cb3377568aaf4423c1c1928dfc5$$@$$20a579236b1c00a47ad70ba415a2eb95759ac1a0$$@$$e0f0471bcab5f05948c6f53fbe3770b311fd97f5$$@$$118d636731bc100eeeb7f81dca59919895cd01aa
3fcee6d2b01a34caf5d2300ae258d0b46ab089f3,Group decision making based on linguistic intuitionistic fuzzy Yager weighted arithmetic aggregation operator of linguistic intuitionistic fuzzy numbers,74d5e9445c8154c8a77cc71487a4c5cfd9a9588c
961d1bd94ebb5de91dfee34147467a934e1ff362,A multi-stage approach for design concept evaluation based on complex network and bounded confidence to achieve consensus,459833e41ab1b331f76904114033095f9dfb5bca$$@$$6a126fba36cae0176584ad4a1b93f7aeef6287dd$$@$$f56e8ad503cc122a91b84b7e9f4b05507a5fdf80
6f89c693dc1107e1375abe7730b86332fed1b29e,Asymmetric normalized probabilistic linguistic term set based on prospect theory and its application to multi-attribute decision-making,58a1de70b53147a977e0745840efe12c87938a40$$@$$74d5e9445c8154c8a77cc71487a4c5cfd9a9588c
d61c15b3a4723a905cd70768db7ab37622de0db3,A novel kernel principal component analysis with application disaster preparedness of hospital: interval-valued Fermatean fuzzy set approach,74d5e9445c8154c8a77cc71487a4c5cfd9a9588c
8f41e6d0edd892df7535e9e88de918613026de70,A Two-Stage Large Group Decision-Making Method Based on a Self-Confident Double Hierarchy Interval Hesitant Fuzzy Language,74d5e9445c8154c8a77cc71487a4c5cfd9a9588c
05e1385c4848179502ad7b0957c86e73d1010806,A novel linguistic decision making approach based on attribute correlation and EDAS method,20a579236b1c00a47ad70ba415a2eb95759ac1a0$$@$$74d5e9445c8154c8a77cc71487a4c5cfd9a9588c
1e676a948d9d0e168664ab828da2aba8acf645a0,A three-way decisions approach based on double hierarchy linguistic aggregation operators of strict t-norms and t-conorms,20a579236b1c00a47ad70ba415a2eb95759ac1a0$$@$$74d5e9445c8154c8a77cc71487a4c5cfd9a9588c
738e2411181e5fc4e9f7b92b8faf79475354d0c8,Mine safety evaluation method using correlation coefficients of consistency linguistic neutrosophic sets in a linguistic neutrosophic multivalued environment,97e81453e6d2bfb40abeaee15d3158c8d2391a8e$$@$$4145e178692a5d690d43ad0fcf0fb3cae2ddd207$$@$$74d5e9445c8154c8a77cc71487a4c5cfd9a9588c
89b3f629677699a5154183d667acbc112daea0ae,Safety Perception Evaluation of Civil Aviation Based on Weibo Posts in China: An Enhanced Large-Scale Group Decision-Making Framework,20a579236b1c00a47ad70ba415a2eb95759ac1a0
320ecad103a7fc4a43d6c43dea753bec3516d33c,Chebyshev Distance Entropy Combined with TODIM Method in Lq-ROFS Multiattribute Group Decision Making,4145e178692a5d690d43ad0fcf0fb3cae2ddd207$$@$$74d5e9445c8154c8a77cc71487a4c5cfd9a9588c
59d91d7e9466236781c34813914d01a508b91b78,A New Approach to Artificial Intelligent Based Three-Way Decision Making and Analyzing S-Box Image Encryption Using TOPSIS Method,20a579236b1c00a47ad70ba415a2eb95759ac1a0
4d15916f24047bf9e1a2fb33d9fa1f8dd4ebedd0,Novel entropy and distance measures of linguistic interval-valued q-Rung orthopair fuzzy sets,97e81453e6d2bfb40abeaee15d3158c8d2391a8e$$@$$74d5e9445c8154c8a77cc71487a4c5cfd9a9588c
ce9bb3e15742bfe047a5838d3733168d621a278c,A new situation assessment method for aerial targets based on linguistic fuzzy sets and trapezium clouds,f300a4b674ca36708c91d7927cd8eb97d7bffb5c$$@$$74d5e9445c8154c8a77cc71487a4c5cfd9a9588c
730266958da87efb52e7e9073967d2ac1517d2cb,Group decision making with hesitant fuzzy linguistic preference relations based on multiplicative DEA cross-efficiency and stochastic acceptability analysis,74d5e9445c8154c8a77cc71487a4c5cfd9a9588c
adb3ebf9e275bf4d408255cf4ac1f42e68536c99,Matrix games involving interval-valued hesitant fuzzy linguistic sets and its application to electric vehicles,20a579236b1c00a47ad70ba415a2eb95759ac1a0$$@$$74d5e9445c8154c8a77cc71487a4c5cfd9a9588c
c8b92e599bc597bc47f8bdf9bb928152cb254654,Some interactive uncertain linguistic aggregation operators based on Shapley function and their application,acaaecec961d1dae0f78412ed56202582a230d34$$@$$6398f2a25cb985ee48e985314510b9f16b708397
a9181c93fdafb3118c68fe824b44884988fc3fa0,An Integrative Decision-Making Mechanism for Consumers’ Brand Selection using 2-Tuple Fuzzy Linguistic Perceptions and Decision Heuristics,f300a4b674ca36708c91d7927cd8eb97d7bffb5c$$@$$20a579236b1c00a47ad70ba415a2eb95759ac1a0$$@$$6398f2a25cb985ee48e985314510b9f16b708397$$@$$74d5e9445c8154c8a77cc71487a4c5cfd9a9588c
fe47ea227716e93769e8f10882406e960f9c29d0,An interval-valued linguistic Markov decision model with fast convergency,97e81453e6d2bfb40abeaee15d3158c8d2391a8e
fcbfb057c62e0b40dc80506aad6162c86ac9e843,Linguistic Z-Number Preference Relation for Group Decision Making and its Application in Digital Transformation Assessment of Smes,74d5e9445c8154c8a77cc71487a4c5cfd9a9588c
2cd84576a8e02dcd5b50b05648add6bfe68572d9,Probabilistic linguistic decision-making based on the hybrid entropy and cross-entropy measures,74d5e9445c8154c8a77cc71487a4c5cfd9a9588c
83e6c27b0ce7f1df33c6c6c1fce8132b6d9706ff,Cosine similarity measures between q-rung orthopair linguistic sets and their application to group decision making problems,74d5e9445c8154c8a77cc71487a4c5cfd9a9588c
9c1fed2f3c513f5552275c2fe2acf954f11727f2,A gentle introduction and survey on Computing with Words (CWW) methodologies,20a579236b1c00a47ad70ba415a2eb95759ac1a0
d6315d53fb363373fb10af835877cba0a45c10ba,MAGDM in hesitant interval-valued Pythagorean linguistic Z-number based on combined score function and entropy,74d5e9445c8154c8a77cc71487a4c5cfd9a9588c
4379a9ea6753ebc83ff759dbafc2a9c2b56c08b1,Hesitant 2-tuple fuzzy linguistic multi-criteria decision-making method based on correlation measures,4145e178692a5d690d43ad0fcf0fb3cae2ddd207$$@$$20a579236b1c00a47ad70ba415a2eb95759ac1a0$$@$$74d5e9445c8154c8a77cc71487a4c5cfd9a9588c
d7b779d692c80eff72ce9465910c0b71d1fc15e2,Robot Selection Using An Integrated MAGDM Model Based on ELECTRE Method and Linguistic q-Rung Orthopair Fuzzy Information,4145e178692a5d690d43ad0fcf0fb3cae2ddd207$$@$$74d5e9445c8154c8a77cc71487a4c5cfd9a9588c
5ffcc4c07908aed13ca0a1907c3bb0a7fd8eea40,Reliability-based multi-attribute large group decision making under probabilistic linguistic environment,74d5e9445c8154c8a77cc71487a4c5cfd9a9588c
0619a8a38d691eb169225fd746d93cfe8a7edc82,Group decision making based on weighted distance measure of linguistic intuitionistic fuzzy sets and the TOPSIS method,74d5e9445c8154c8a77cc71487a4c5cfd9a9588c
6c1989a22869d1258db6124ee6ca5a4da0cd7f69,Decision-Making Models Based on Incomplete Hesitant Fuzzy Linguistic Preference Relation With Application to Site Selection of Hydropower Stations,acaaecec961d1dae0f78412ed56202582a230d34$$@$$4145e178692a5d690d43ad0fcf0fb3cae2ddd207$$@$$74d5e9445c8154c8a77cc71487a4c5cfd9a9588c$$@$$f56e8ad503cc122a91b84b7e9f4b05507a5fdf80
71ae4044184c42b79ae5941ea210d4e32c74168d,Uncertainty measures of complex preference relations for decision making,ce583eca7b4ec66a141d9573046da224ca33a7f3
44b5a0eca77c9f1343ce75a1f683235f6e283ed1,Assessment of Hydropower Plants in Pakistan: Muirhead Mean-Based 2-Tuple Linguistic T-spherical Fuzzy Model Combining SWARA with COPRAS,20a579236b1c00a47ad70ba415a2eb95759ac1a0$$@$$74d5e9445c8154c8a77cc71487a4c5cfd9a9588c
73d8814414ea524fc40ede057ed703dcf2938283,A DEMATEL-Based Method for Linguistic Multiple Attributes Group Decision Making Using Strict t-Norms and t-Conorms,6a126fba36cae0176584ad4a1b93f7aeef6287dd$$@$$f300a4b674ca36708c91d7927cd8eb97d7bffb5c$$@$$97e81453e6d2bfb40abeaee15d3158c8d2391a8e$$@$$20a579236b1c00a47ad70ba415a2eb95759ac1a0$$@$$6398f2a25cb985ee48e985314510b9f16b708397
f9dd60263326b9756e2928baefb1275bf14cafa1,MCGDM model using uncertain linguistic consistency sets of single and interval linguistic term multivalued sets,4145e178692a5d690d43ad0fcf0fb3cae2ddd207$$@$$74d5e9445c8154c8a77cc71487a4c5cfd9a9588c
0fdaa45746973f9c99351218f10ea94f34b172a9,The interactive fuzzy linguistic term set and its application in multi-attribute decision making,74d5e9445c8154c8a77cc71487a4c5cfd9a9588c
ea32029cbab5673873513c2f81da76dcad016baf,Linguistic q-rung orthopair fuzzy multiple-attribute group decision making based on the grey similarity degree and PROMETHEE II method,20a579236b1c00a47ad70ba415a2eb95759ac1a0$$@$$74d5e9445c8154c8a77cc71487a4c5cfd9a9588c
1b97cf673fd07e9addfd2f69924d737384e17095,Multiple-attribute group decision-making method based on intuitionistic multiplicative linguistic information,9268d1f5e71663fe194ad40073858f14d101750c$$@$$74d5e9445c8154c8a77cc71487a4c5cfd9a9588c
b62a6b3895aed060f752aefffc5c36a6950e9c7a,EVALUATION OF GOVERNMENT INVESTMENT USING NESTED PROBABILISTIC LINGUISTIC PREFERENCE RELATIONS BASED ON GRAPH THEORY,20a579236b1c00a47ad70ba415a2eb95759ac1a0$$@$$74d5e9445c8154c8a77cc71487a4c5cfd9a9588c
1743431b0fb5556e92ae41414723547fedea8d87,Consensus reaching model for counter-intuitive in D-S evidence theory and application under 2-tuple linguistic representation,20a579236b1c00a47ad70ba415a2eb95759ac1a0
ee0d4fdda2157ec38bc4e6d6aaaf890abb689501,Nested information representation of multi-dimensional decision: An improved PROMETHEE method based on NPLTSs,74d5e9445c8154c8a77cc71487a4c5cfd9a9588c
32b1252606326f3a9b0cb73fa82283d87a9bac31,2-Öğeli Tam Dilsel Sezgisel Bulanık Küme Yaklaşımı: Karar Verme Üzerine Bir Uygulama,20a579236b1c00a47ad70ba415a2eb95759ac1a0$$@$$74d5e9445c8154c8a77cc71487a4c5cfd9a9588c
ce1e655d5111b23bd5f0d7eb1a8f37776bf57844,A Ranking Method Based on Relative Score under the Interval-Valued Intuitionistic Z-Linguistic Environment and Its Application in Rural Revitalization Strategy,97e81453e6d2bfb40abeaee15d3158c8d2391a8e$$@$$74d5e9445c8154c8a77cc71487a4c5cfd9a9588c
0f2efc55af067c83dbf039b35e1109c1b449c869,A Novel Approach of Linguistic Picture Fuzzy Dombi Heronian Mean Operators and their Application to Emergency Program Selection,97e81453e6d2bfb40abeaee15d3158c8d2391a8e$$@$$20a579236b1c00a47ad70ba415a2eb95759ac1a0$$@$$74d5e9445c8154c8a77cc71487a4c5cfd9a9588c
975e34d00e0528236108aae7d2b7359ed82d381c,A Multiattribute Group Decision-Making Method With Probabilistic Linguistic Information Based on an Adaptive Consensus Reaching Model and Evidential Reasoning,74d5e9445c8154c8a77cc71487a4c5cfd9a9588c
d9b1fb2dee351bf99da85abc550f14c348e30132,Additive consistency exploration of linguistic preference relations with self-confidence,459833e41ab1b331f76904114033095f9dfb5bca$$@$$20a579236b1c00a47ad70ba415a2eb95759ac1a0
f5efd6f244895d403bfe3a55af6b7a1d501a34f0,Uncertain linguistic terms with weakened hedges for multi-granular linguistic decision making with its application to evaluating communication technologies,20a579236b1c00a47ad70ba415a2eb95759ac1a0$$@$$74d5e9445c8154c8a77cc71487a4c5cfd9a9588c
69a7699c36348825d206f16bf17665410bb09fd2,Linguistic multi-criteria decision-making aggregation model based on situational ME-LOWA and ME-LOWGA operators,74d5e9445c8154c8a77cc71487a4c5cfd9a9588c$$@$$26f15d696dc84cb3377568aaf4423c1c1928dfc5$$@$$ce583eca7b4ec66a141d9573046da224ca33a7f3$$@$$e0f0471bcab5f05948c6f53fbe3770b311fd97f5$$@$$c0586959cf8e8f59097c4a25a859d936306ab716$$@$$6398f2a25cb985ee48e985314510b9f16b708397
feed17c23e94a13e745f8b0345d988e50137715e,Evaluations for medical diagnoses phenomena through 2˟ 2 linguistic neutrosophic environment-based game situation,74d5e9445c8154c8a77cc71487a4c5cfd9a9588c
1dfd65db0218bc70fd4f092996188d55f30d9f14,A new three-way group decision-making model based on geometric heronian mean operators with q-rung orthopair uncertain linguistic information,74d5e9445c8154c8a77cc71487a4c5cfd9a9588c
19749904a1a843099c33b065951e97e6b90f593e,A Stochastic Perspective on a Group Decision-Making Method Based on Two-Dimension 2-Tuple Linguistic Information,20a579236b1c00a47ad70ba415a2eb95759ac1a0$$@$$74d5e9445c8154c8a77cc71487a4c5cfd9a9588c
c8d2b7c76725c30148cc7ab53893abb6b9563d3a,A Novel Approach for Multiplicative Linguistic Group Decision Making Based on Symmetrical Linguistic Chi-Square Deviation and VIKOR Method,74d5e9445c8154c8a77cc71487a4c5cfd9a9588c
4d3911edbdbd4039adecb11062e4c6c223fa80ed,A modified VIKOR method for group decision-making based on aggregation operators for hesitant intuitionistic fuzzy linguistic term sets,9268d1f5e71663fe194ad40073858f14d101750c$$@$$4145e178692a5d690d43ad0fcf0fb3cae2ddd207$$@$$6398f2a25cb985ee48e985314510b9f16b708397
6ac3ad4b0665584e6e19a791076b75b2f1c869a6,Three-way decision model under a large-scale group decision-making environment with detecting and managing non-cooperative behaviors in consensus reaching process,4145e178692a5d690d43ad0fcf0fb3cae2ddd207$$@$$74d5e9445c8154c8a77cc71487a4c5cfd9a9588c
272700279a341532b05b76251f47cfe430fb06ed,The application of probabilistic linguistic CODAS method based on new score function in multi-criteria decision-making,20a579236b1c00a47ad70ba415a2eb95759ac1a0$$@$$74d5e9445c8154c8a77cc71487a4c5cfd9a9588c
e0ccb1bd150086b4d79f5eff5e2a84934bc43cea,Statistical and analytical approach of multi-criteria group decision-making based on the correlation coefficient under intuitionistic 2-tuple fuzzy linguistic environment,4145e178692a5d690d43ad0fcf0fb3cae2ddd207$$@$$20a579236b1c00a47ad70ba415a2eb95759ac1a0$$@$$74d5e9445c8154c8a77cc71487a4c5cfd9a9588c
72377a18561d7929deaf5cf50f36425a0106ad41,Correction to: Multiple attribute group decision-making based on generalized aggregation operators under linguistic interval-valued Pythagorean fuzzy environment,74d5e9445c8154c8a77cc71487a4c5cfd9a9588c
6bb0aff79b0232b004b8715cb84bebce41bf3748,The Interval probabilistic double hierarchy linguistic EDAS method based on natural language processing basic techniques and its application to hotel online reviews,20a579236b1c00a47ad70ba415a2eb95759ac1a0$$@$$74d5e9445c8154c8a77cc71487a4c5cfd9a9588c
0e631142c331b54b695d2f2edc6cded6e964a819,A Consensus-Reaching Approach to the Evaluation of Product Design Alternatives with Multiple Preference Structures,ce538378a9f9fb1b8ded834b4745c7f15c19cd40$$@$$6a126fba36cae0176584ad4a1b93f7aeef6287dd$$@$$f56e8ad503cc122a91b84b7e9f4b05507a5fdf80$$@$$459833e41ab1b331f76904114033095f9dfb5bca$$@$$6398f2a25cb985ee48e985314510b9f16b708397
f816d60eef9c0b3cdeb2ad5344a475c1d832119f,Multiple attribute group decision making based on advanced linguistic intuitionistic fuzzy weighted averaging aggregation operator of linguistic intuitionistic fuzzy numbers,74d5e9445c8154c8a77cc71487a4c5cfd9a9588c
3235d46bc2834c53ce879ff9cd4d301a7eaba6c2,Towards achieving consistent opinion fusion in group decision making with complete distributed preference relations,459833e41ab1b331f76904114033095f9dfb5bca$$@$$7d631b6633cfa1961e6575aa99ed1eae8a04fde9$$@$$7f869b34992d6fe24bdd01cef8d11cae0d3de172$$@$$f56e8ad503cc122a91b84b7e9f4b05507a5fdf80
90cf15ae18e4a00a8959a74ca26788dd6e852bf2,An interval valued neutrosophic decision-making structure for sustainable supplier selection,74d5e9445c8154c8a77cc71487a4c5cfd9a9588c
105e30e7b4f2545d2e11073795f25c2d532089b0,A novel approach on decision support system based on triangular linguistic cubic fuzzy Dombi aggregation operators,97e81453e6d2bfb40abeaee15d3158c8d2391a8e$$@$$74d5e9445c8154c8a77cc71487a4c5cfd9a9588c
aed411e18e075e80781b2c8d22671811516312c6,Multiplicative consistency analysis of linguistic preference relation with self‐confidence level and self‐doubting level and its application in a group decision making,4145e178692a5d690d43ad0fcf0fb3cae2ddd207$$@$$74d5e9445c8154c8a77cc71487a4c5cfd9a9588c
69fc55e1f5801ce9b19568ec9f03472c19df7836,The evidential reasoning approach for renewable energy resources evaluation under interval type-2 fuzzy uncertainty,74d5e9445c8154c8a77cc71487a4c5cfd9a9588c
3a2ae626e2dd37ecba87919c6d46eb04018ad2f7,K-means clustering for the aggregation of HFLTS possibility distributions: N-two-stage algorithmic paradigm,20a579236b1c00a47ad70ba415a2eb95759ac1a0$$@$$74d5e9445c8154c8a77cc71487a4c5cfd9a9588c
0e9fb521bfa8d0120b34df8bc415a5e5e89a7f36,"An Overview of Studies Based on the Probability-Based Decision-Making Information: Current Developments, Methodologies, Applications and Challenges",20a579236b1c00a47ad70ba415a2eb95759ac1a0$$@$$74d5e9445c8154c8a77cc71487a4c5cfd9a9588c
dbcb46caf9581386cc72b71dbf478b0d0b1111ff,Three‐way decisions based on some Hamacher aggregation operators under double hierarchy linguistic environment,20a579236b1c00a47ad70ba415a2eb95759ac1a0
376f21f2309ac498881e6aeb489b8d91322351eb,Projection-based probabilistic linguistic multi-criteria decision-making method for new energy project selection,4145e178692a5d690d43ad0fcf0fb3cae2ddd207$$@$$74d5e9445c8154c8a77cc71487a4c5cfd9a9588c
259a7e6d609734f8f3891778a99fded46f97680e,A Quantum Probabilistic Linguistic Term Framework to Multi-attribute Decision-Making for Battlefield Situation Assessment,acaaecec961d1dae0f78412ed56202582a230d34$$@$$74d5e9445c8154c8a77cc71487a4c5cfd9a9588c
98a684333cceb3aeaedbc6ba03ffe4c79282a7e7,A consensus model for group decision making with self‐confident linguistic preference relations,26f15d696dc84cb3377568aaf4423c1c1928dfc5$$@$$7d631b6633cfa1961e6575aa99ed1eae8a04fde9$$@$$f300a4b674ca36708c91d7927cd8eb97d7bffb5c$$@$$459833e41ab1b331f76904114033095f9dfb5bca
5432adc5916bcfb95fcab650ffa827540025f737,Multiple Attribute Decision Making Based on Linguistic Generalized Weighted Heronian Mean,4145e178692a5d690d43ad0fcf0fb3cae2ddd207
0b77bad632100a640a211b7fa51bf536ff1b38e1,Large-scale consensus with endo-confidence under probabilistic linguistic circumstance and its application,74d5e9445c8154c8a77cc71487a4c5cfd9a9588c
847d85a6ac628f7558a30bf4415c44076942e41d,A Novel Multi-Criteria Group Decision-Making Approach Based on Bonferroni and Heronian Mean Operators under Hesitant 2-Tuple Linguistic Environment,4145e178692a5d690d43ad0fcf0fb3cae2ddd207$$@$$f300a4b674ca36708c91d7927cd8eb97d7bffb5c$$@$$20a579236b1c00a47ad70ba415a2eb95759ac1a0$$@$$74d5e9445c8154c8a77cc71487a4c5cfd9a9588c
18f4539e4930a3d9377bc294235baf40b7a4439f,A PROMETHEE II Approach Based on Probabilistic Hesitant Fuzzy Linguistic Information with Applications to Multi-Criteria Group Decision-Making (ICSSE 2020),4145e178692a5d690d43ad0fcf0fb3cae2ddd207
f36f78a56a4bd2948c5eac8c9a0d6ff2af5cf550,Linguistic Einstein aggregation operator‐based TOPSIS for multicriteria group decision making in linguistic Pythagorean fuzzy environment,4145e178692a5d690d43ad0fcf0fb3cae2ddd207$$@$$74d5e9445c8154c8a77cc71487a4c5cfd9a9588c
3f0740dabbca64d2c0bbaf5574a4f932b067cbb6,Linguistic single‐valued neutrosophic soft sets with applications in game theory,4145e178692a5d690d43ad0fcf0fb3cae2ddd207$$@$$74d5e9445c8154c8a77cc71487a4c5cfd9a9588c
3925c5c5cf443247989bdb351b43ab68d2cd4b87,Pythagorean fuzzy linguistic decision support model based on consistency-adjustment strategy and consensus reaching process,74d5e9445c8154c8a77cc71487a4c5cfd9a9588c
ee4d40fa8153f9a38ae6ed5de4a8d9e8e6890225,Interactive multi-criteria group decision-making with probabilistic linguistic information for emergency assistance of COVID-19,20a579236b1c00a47ad70ba415a2eb95759ac1a0
e20ff99fcff26a504528620aeb58affae4f512fd,A hesitant fuzzy linguistic bi-objective clustering method for large-scale group decision-making,20a579236b1c00a47ad70ba415a2eb95759ac1a0
5500e9f1cd25b674335547a9597db0ceb71dfa3b,An optimisation-based method to conduct consistency and consensus in group decision making under probabilistic uncertain linguistic preference relations,7d631b6633cfa1961e6575aa99ed1eae8a04fde9$$@$$74d5e9445c8154c8a77cc71487a4c5cfd9a9588c
a1a75535c4f3b31ce6da530c398f5f0c60c21cbf,Generalized interval-valued picture fuzzy linguistic induced hybrid operator and TOPSIS method for linguistic group decision-making,97e81453e6d2bfb40abeaee15d3158c8d2391a8e$$@$$20a579236b1c00a47ad70ba415a2eb95759ac1a0$$@$$ce538378a9f9fb1b8ded834b4745c7f15c19cd40$$@$$74d5e9445c8154c8a77cc71487a4c5cfd9a9588c
a693733af0447083845066f91aa359c8f15cb041,Using Vector Random Linguistic Variables to Manage Consistency and Consensus in Linguistic Group Decision-Making for Public Project,74d5e9445c8154c8a77cc71487a4c5cfd9a9588c$$@$$7d631b6633cfa1961e6575aa99ed1eae8a04fde9$$@$$97e81453e6d2bfb40abeaee15d3158c8d2391a8e$$@$$58a1de70b53147a977e0745840efe12c87938a40$$@$$4145e178692a5d690d43ad0fcf0fb3cae2ddd207
bcf91e5751c3abaf4c56efb50ee2f25d5077e703,A comprehensive bibliometric analysis of uncertain group decision making from 1980 to 2019,74d5e9445c8154c8a77cc71487a4c5cfd9a9588c
ffcb027fed5957569c6f480ab965a3736e3568ea,A New Multicriteria Decision-Making Method for the Selection of Sponge City Schemes with Shapley–Choquet Aggregation Operators,6398f2a25cb985ee48e985314510b9f16b708397
44efcba2ff88ab107dd574ecdb4bae9808e5ae48,Group decision making for internet public opinion emergency based upon linguistic intuitionistic fuzzy information,20a579236b1c00a47ad70ba415a2eb95759ac1a0$$@$$74d5e9445c8154c8a77cc71487a4c5cfd9a9588c
4a3213b834abe56c5f652da76d4dff873de1b355,Work Resumption After Epidemic Using Three-Way Decisions,20a579236b1c00a47ad70ba415a2eb95759ac1a0
e5418590d33d1369934fab2c9d2d4ef96eb0622e,Linguistic interval-valued intuitionistic fuzzy copula power aggregation operators for multiattribute group decision making,20a579236b1c00a47ad70ba415a2eb95759ac1a0$$@$$74d5e9445c8154c8a77cc71487a4c5cfd9a9588c
a9bc13c71a949de27877c8e9eaccf22e264f03b2,Revisiting Fuzzy and Linguistic Decision Making: Scenarios and Challenges for Making Wiser Decisions in a Better Way,7f869b34992d6fe24bdd01cef8d11cae0d3de172$$@$$74d5e9445c8154c8a77cc71487a4c5cfd9a9588c$$@$$f300a4b674ca36708c91d7927cd8eb97d7bffb5c$$@$$20a579236b1c00a47ad70ba415a2eb95759ac1a0$$@$$459833e41ab1b331f76904114033095f9dfb5bca$$@$$6398f2a25cb985ee48e985314510b9f16b708397
c44f67744bb93722d500300edd371e190bb10481,A multidimensional decision with nested probabilistic linguistic term sets and its application in corporate investment,20a579236b1c00a47ad70ba415a2eb95759ac1a0
39de40dc74b52c2030eca9ae0ad4430166d49756,Group decision making based on acceptable multiplicative consistency and consensus of hesitant fuzzy linguistic preference relations,459833e41ab1b331f76904114033095f9dfb5bca$$@$$acaaecec961d1dae0f78412ed56202582a230d34$$@$$ce538378a9f9fb1b8ded834b4745c7f15c19cd40$$@$$74d5e9445c8154c8a77cc71487a4c5cfd9a9588c
